{
	"$schema": "./dictionary.schema.json",
	"meta": {
		"description": "Comprimi e archivia i tuoi file direttamente nel browser con supporto per i formati ZIP, TAR e TAR.GZ. Nessun caricamento sul server, nessuna installazione richiesta e protezione completa della privacy. Tutta l'elaborazione della compressione avviene localmente sul tuo dispositivo, garantendo che i tuoi file sensibili non lascino mai il tuo computer."
	},
	"compress": {
		"heading": "Comprimi file nel browser",
		"description": "Comprimi i file nel tuo browser senza installare alcun programma.\nTutti i processi di compressione vengono eseguiti nel browser e nessun file viene inviato al server.\nFormati di file supportati: ZIP, TAR, TAR.GZ",

		"warning": {
			"title": "Si è verificato un errore."
		},
		"preview": {
			"title": "Anteprima file",
			"description": "I file selezionati saranno compressi.",
			"tableColumn": [
				"Nome file",
				"Dimensione",
				"Tipo"
			]
		},
		"submit": {
			"idle": "Comprimi",
			"active": "Compressione in corso..."
		},
		"file": "File",
		"directory": "Directory",
		"fileDrop": {
			"title": "Trascina e rilascia i tuoi file qui",
			"description": "Oppure clicca per selezionare i file dal tuo computer",
			"button": "Seleziona file"
		}
	},
	"decompress": {
		"heading": "Decomprimi file nel browser",
		"description": "Decomprimi i file nel tuo browser senza installare alcun programma.\nTutti i processi di decompressione vengono eseguiti nel browser e nessun file viene inviato al server.\nFormati di file supportati: ZIP, TAR, TAR.GZ",

		"warning": {
			"title": "Si è verificato un errore."
		},
		"preview": {
			"title": "Anteprima file",
			"description": "Il contenuto del file compresso selezionato verrà estratto.",
			"tableColumn": [
				"Nome file",
				"Dimensione",
				"Tipo"
			]
		},
		"submit": {
			"idle": "Decomprimi",
			"active": "Decompressione in corso..."
		},
		"file": "File",
		"fileDrop": {
			"title": "Trascina e rilascia il tuo file compresso qui",
			"description": "Oppure clicca per selezionare un file compresso dal tuo computer",
			"button": "Seleziona file"
		}
	},
	"header": {
		"decompress": "Decomprimi",
		"compress": "Comprimi"
	},
	"footer": {
		"termsOfService": "Termini di servizio",
		"privacyPolicy": "Informativa sulla privacy",
		"contact": "Contattaci"
	}
}